### ISSUE TITLE
When noreply is used server closes unexpectedly the connection

### ISSUE THREAD

**Issue by pfreixes** [memcached/memcached#681]
**Describe the bug**
When Im trying to send a set command with the `noreply` flag the server closes the connection unexpectedly.

The command sent has the following data `set key 0 0 5 noreply\r\nvalue\r\n`

The Memcached server started with three levels of verbosity says:
```
<19 new auto-negotiating client connection
19: going from conn_new_cmd to conn_waiting
19: going from conn_waiting to conn_read
19: going from conn_read to conn_parse_cmd
19: Client using the ascii protocol
<19 set key 0 0 5 noreply
19: going from conn_parse_cmd to conn_nread
> NOT FOUND key
>19 NOREPLY STORED
19: going from conn_nread to conn_new_cmd
19: going from conn_new_cmd to conn_mwrite
Failed to write, and not due to blocking: Message too long
19: going from conn_mwrite to conn_closing
<19 connection closed.
19: going from conn_closing to conn_closed
```

While the tcmpdump between the client and the server is the following one

```
22:30:43.969767 IP6 localhost.54547 > localhost.11211: Flags [S], seq 2204362658, win 65535, options [mss 16324,nop,wscale 6,nop,nop,TS val 1262036203 ecr 0,sackOK,eol], length 0
22:30:43.969862 IP6 localhost.11211 > localhost.54547: Flags [S.], seq 3730121260, ack 2204362659, win 65535, options [mss 16324,nop,wscale 6,nop,nop,TS val 1262036203 ecr 1262036203,sackOK,eol], length 0
22:30:43.969875 IP6 localhost.54547 > localhost.11211: Flags [.], ack 1, win 6371, options [nop,nop,TS val 1262036203 ecr 1262036203], length 0
22:30:43.969888 IP6 localhost.11211 > localhost.54547: Flags [.], ack 1, win 6371, options [nop,nop,TS val 1262036203 ecr 1262036203], length 0
22:30:43.970634 IP6 localhost.54547 > localhost.11211: Flags [P.], seq 1:31, ack 1, win 6371, options [nop,nop,TS val 1262036203 ecr 1262036203], length 30
22:30:43.970652 IP6 localhost.11211 > localhost.54547: Flags [.], ack 31, win 6371, options [nop,nop,TS val 1262036203 ecr 1262036203], length 0
22:30:43.972068 IP6 localhost.11211 > localhost.54547: Flags [F.], seq 1, ack 31, win 6371, options [nop,nop,TS val 1262036205 ecr 1262036203], length 0
22:30:43.972092 IP6 localhost.54547 > localhost.11211: Flags [.], ack 2, win 6371, options [nop,nop,TS val 1262036205 ecr 1262036205], length 0
22:30:43.972381 IP6 localhost.54547 > localhost.11211: Flags [F.], seq 31, ack 2, win 6371, options [nop,nop,TS val 1262036205 ecr 1262036205], length 0
22:30:43.972412 IP6 localhost.11211 > localhost.54547: Flags [.], ack 32, win 6371, options [nop,nop,TS val 1262036205 ecr 1262036205], length 0
```

Despite that, the client sent a `noreply` option seems that the Memcached server is trying to send something which triggers an issue here [1] which will end up closing the connection proactively by the Memcached client - as can be seen by the tcpdump.

As can be also observed in the tcpdump log between the client sends the data and the Memcached closes the connection nothing else is happening.

Also worth to mention that, even sending a `noreply` flag which is well identified - as can be observed in the memcached output - the memcached server is trying to send something which finally triggers the error.

[1] https://github.com/memcached/memcached/blob/master/memcached.c#L6852

**To Reproduce**
Just send the payload `set key 0 0 5 noreply\r\nvalue\r\n`

**System Information**
 - OS/Distro: MacOs
 - Version of OS/distro: Mojave
 - Version of memcached: 1.6.5
 - Hardware detail:

**Detail (please include!)**
Please refer to the *Describe the bug* section

**Comment by pfreixes** [comment]
Using the same version provided by docker, Memcached behaves as would be expected

```
<28 new auto-negotiating client connection
28: Client using the ascii protocol
<28 set key 0 0 5 noreply
>28 NOREPLY STORED
```

```
$ docker-compose run memcached  --version
memcached 1.6.5
```

**Comment by dormando** [comment]
Thanks! will look into it. how did you initially install it? via tarball?

**Comment by dormando** [comment]
Also; does the t/noreply.t test fail on your problematic platform?

The new network code implements noreply via invalidating the status message. it still roundtrips through the transmit code though it's not supposed to do anything. I either left out a fast return when total tx length is 0 or there's another bug which causes a garbage/negative length on this platform. Or it just hates getting a message with a length of 0.

Need to revisit, just leaving some notes for myself here.

**Comment by pfreixes** [comment]
Hi @dormando Ive installed it through `brew`. 

Ive just run the tests and something fails

```
$ make test
./sizes
Slab Stats	64
Thread stats	-6344
Global stats	192
Settings	576
Item (no cas)	48
Item (cas)	56
extstore header	12
Libevent thread	208
Connection	432
----------------------------------------
libevent thread cumulative	6664
Thread stats cumulative		6456
./testapp
1..57
ok 1 - cache_create
ok 2 - cache_constructor
ok 3 - cache_constructor_fail
ok 4 - cache_destructor
ok 5 - cache_reuse
ok 6 - cache_redzone
ok 7 - stats_prefix_find
ok 8 - stats_prefix_record_get
ok 9 - stats_prefix_record_delete
ok 10 - stats_prefix_record_set
ok 11 - stats_prefix_dump
ok 12 - issue_161
ok 13 - strtol
ok 14 - strtoll
ok 15 - strtoul
ok 16 - strtoull
ok 17 - issue_44
ok 18 - vperror
ok 19 - issue_101
Signal handled: Terminated: 15.
ok 20 - start_server
ok 21 - issue_92
ok 22 - issue_102
ok 23 - binary_noop
ok 24 - binary_quit
ok 25 - binary_quitq
ok 26 - binary_set
ok 27 - binary_setq
ok 28 - binary_add
ok 29 - binary_addq
ok 30 - binary_replace
Failed to read: Connection reset by peer
make: *** [test] Abort trap: 6
```

If I have a bit of time I could dig into this.

**Comment by dormando** [comment]
Thanks. Try directly running `prove t/noreply.t` as well.

@devnexen you run into this on OSX at all? I've now seen at least three different "OS X" installs of supposedly the same/similar version of the OS that have three completely distinct failures :|

**Comment by pfreixes** [comment]
successfully passed
```
$ prove t/noreply.t
t/noreply.t .. ok
All tests successful.
Files=1, Tests=9,  2 wallclock secs ( 0.02 usr  0.02 sys +  0.04 cusr  0.02 csys =  0.10 CPU)
Result: PASS
```

**Comment by devnexen** [comment]
Yes I get that too.

**Comment by dormando** [comment]
https://github.com/memcached/memcached/pull/683 - likely fixed here. With this all tests seem to pass fine in OS X. Sometimes watcher.t fails but it stopped failing when I went poking for it..

The noreply.t was probably passing before since, for some reason, under unix domain sockets the sendmsg() of 0 doesn't fail. Macs seem to be slowly losing their minds. :\

**Comment by pfreixes** [comment]
Thanks!
