### ISSUE TITLE
Slow response for non-existent key via binary protocol.

### ISSUE THREAD

**Issue by k0ka** [memcached/memcached#1003]
**Describe the bug**
When using binary protocol and mget non-existent key the memcached answers takes too long. About 40ms on my test Ryzen 5 3600.

**To Reproduce**
1. start a new memcached instance on an empty server
2. run `tcpdump -nnvvvXi lo port 11211`
3. request any key (I used `libmemcached-awesome`) via binary protocol.
4. tcpdump will show timestamps. It will take tens of ms to response. Existent key responses are much faster - less than 1ms. The non-binary protocol also responses in less than 1 ms for both existent and non-existent keys.

**System Information**
 - rockylinux 8 (RHEL)
 - memcached-1.6.18-1.el8.remi.x86_64

```
[root@serv52 koka]# lscpu
Architecture:        x86_64
CPU op-mode(s):      32-bit, 64-bit
Byte Order:          Little Endian
CPU(s):              12
On-line CPU(s) list: 0-11
Thread(s) per core:  2
Core(s) per socket:  6
Socket(s):           1
NUMA node(s):        1
Vendor ID:           AuthenticAMD
BIOS Vendor ID:      Advanced Micro Devices, Inc.
CPU family:          23
Model:               113
Model name:          AMD Ryzen 5 3600 6-Core Processor
BIOS Model name:     AMD Ryzen 5 3600 6-Core Processor
Stepping:            0
CPU MHz:             3600.000
CPU max MHz:         4208.2031
CPU min MHz:         2200.0000
BogoMIPS:            7185.82
Virtualization:      AMD-V
L1d cache:           32K
L1i cache:           32K
L2 cache:            512K
L3 cache:            16384K
NUMA node0 CPU(s):   0-11
Flags:               fpu vme de pse tsc msr pae mce cx8 apic sep mtrr pge mca cmov pat pse36 clflush mmx fxsr sse sse2 ht syscall nx mmxext fxsr_opt pdpe1gb rdtscp lm constant_tsc rep_good nopl nonstop_tsc cpuid extd_apicid aperfmperf pni pclmulqdq monitor ssse3 fma cx16 sse4_1 sse4_2 movbe popcnt aes xsave avx f16c rdrand lahf_lm cmp_legacy svm extapic cr8_legacy abm sse4a misalignsse 3dnowprefetch osvw ibs skinit wdt tce topoext perfctr_core perfctr_nb bpext perfctr_llc mwaitx cpb cat_l3 cdp_l3 hw_pstate ssbd mba ibpb stibp vmmcall fsgsbase bmi1 avx2 smep bmi2 cqm rdt_a rdseed adx smap clflushopt clwb sha_ni xsaveopt xsavec xgetbv1 xsaves cqm_llc cqm_occup_llc cqm_mbm_total cqm_mbm_local clzero irperf xsaveerptr wbnoinvd arat npt lbrv svm_lock nrip_save tsc_scale vmcb_clean flushbyasid decodeassists pausefilter pfthreshold avic v_vmsave_vmload vgif v_spec_ctrl umip rdpid overflow_recov succor smca sme sev sev_es
[root@serv52 koka]# uname -a
Linux serv52.identityworks.ru 4.18.0-372.9.1.el8.x86_64 #1 SMP Tue May 10 14:48:47 UTC 2022 x86_64 x86_64 x86_64 GNU/Linux
```

**Detail**
I stumbled upon it when investigating another bug in the libmemcached (https://github.com/php-memcached-dev/php-memcached/issues/531). 
I can show tcp dumps if required. 

However, as I saw binary protocol is deprecated so it might be not worth fixing this bug...

**Comment by dormando** [comment]
Thanks. That's pretty bizarre. I'll take a look as soon as I can but it might be a week or two.

Any idea if this is only a problem in recentish versions? I can't imagine misses taking 40ms is something nobody would notice until now.

**Comment by k0ka** [comment]
I started testing on memcached 1.5. And it feels like it had that bug too (I'm not 100% sure though). 

I found a lot of people complaining on slowness of binary protocol:
https://github.com/memcached/memcached/issues/775 - there was an issue here.
https://github.com/acquia/memcache-settings/issues/3
https://bugs.php.net/bug.php?id=59434  - this one is pretty old, not sure if related. But they even writes the same timings as I: 40 ms for unexistant and <1ms for existing .

**Comment by dormando** [comment]
Looks like I didn't follow up on that 775 issue properly, but think I was pretty busy then.

Wish someone had made an issue as clear as yours earlier.

**Comment by dormando** [comment]
Did a super quick test with the binary perl tests. Added near the top:
```
# timing test
use Time::HiRes qw(time);
{
    $mc->set('notmissing', 'doot', 0, 999);
    my $start = time();
    my $rv =()= eval { $mc->get('missing') };
    my $end = time();
    print STDERR "miss elapsed: ", $end - $start, "\n";
    $start = time();
    $rv =()= eval { $mc->get('notmissing') };
    $end = time();   
    print STDERR "not miss elapsed: ", $end - $start, "\n";

}
exit;
```

miss elapsed: 0.00032496452331543
not miss elapsed: 0.000319004058837891

So I guess it isn't that straightforward. There's no way to delay something exactly 40ms (or any ms) in the server. I wonder if libmemcached is making a malformed request or something?

**Comment by k0ka** [comment]
I checked it on my tests. 

It turns out the `memcached_flush` must be used before running the mget. And it doesn't matter if flush was used just before mget or not. Without `memcached_flush` it works properly. Here is the full tcpdump of interaction between libmemcached and the memcached server from starting the server to shutdown. It's big, though it is mostly initialization:

<details>

```

20:50:41.463800 IP (tos 0x0, ttl 64, id 38792, offset 0, flags [DF], proto TCP (6), length 60)
    127.0.0.1.59212 > 127.0.0.1.11211: Flags [S], cksum 0xfe30 (incorrect -> 0x6cc6), seq 58003603, win 65535, options [mss 65495,sackOK,TS val 2579309107 ecr 0,nop,wscale 10], length 0
        0x0000:  4500 003c 9788 4000 4006 a531 7f00 0001  E..<..@.@..1....
        0x0010:  7f00 0001 e74c 2bcb 0375 1093 0000 0000  .....L+..u......
        0x0020:  a002 ffff fe30 0000 0204 ffd7 0402 080a  .....0..........
        0x0030:  99bd 2233 0000 0000 0103 030a            .."3........
20:50:41.463805 IP (tos 0x0, ttl 64, id 0, offset 0, flags [DF], proto TCP (6), length 40)
    127.0.0.1.11211 > 127.0.0.1.59212: Flags [R.], cksum 0x8aad (correct), seq 0, ack 58003604, win 0, length 0
        0x0000:  4500 0028 0000 4000 4006 3cce 7f00 0001  E..(..@.@.<.....
        0x0010:  7f00 0001 2bcb e74c 0000 0000 0375 1094  ....+..L.....u..
        0x0020:  5014 0000 8aad 0000                      P.......
20:50:41.463851 IP (tos 0x0, ttl 64, id 2302, offset 0, flags [DF], proto TCP (6), length 60)
    127.0.0.1.59214 > 127.0.0.1.11211: Flags [S], cksum 0xfe30 (incorrect -> 0xbdf5), seq 1646551218, win 65535, options [mss 65495,sackOK,TS val 2579309107 ecr 0,nop,wscale 10], length 0
        0x0000:  4500 003c 08fe 4000 4006 33bc 7f00 0001  E..<..@.@.3.....
        0x0010:  7f00 0001 e74e 2bcb 6224 60b2 0000 0000  .....N+.b$`.....
        0x0020:  a002 ffff fe30 0000 0204 ffd7 0402 080a  .....0..........
        0x0030:  99bd 2233 0000 0000 0103 030a            .."3........
20:50:41.463852 IP (tos 0x0, ttl 64, id 0, offset 0, flags [DF], proto TCP (6), length 40)
    127.0.0.1.11211 > 127.0.0.1.59214: Flags [R.], cksum 0xdbdc (correct), seq 0, ack 1646551219, win 0, length 0
        0x0000:  4500 0028 0000 4000 4006 3cce 7f00 0001  E..(..@.@.<.....
        0x0010:  7f00 0001 2bcb e74e 0000 0000 6224 60b3  ....+..N....b$`.
        0x0020:  5014 0000 dbdc 0000                      P.......
20:50:41.563967 IP (tos 0x0, ttl 64, id 26020, offset 0, flags [DF], proto TCP (6), length 60)
    127.0.0.1.59216 > 127.0.0.1.11211: Flags [S], cksum 0xfe30 (incorrect -> 0x6f4f), seq 2227276885, win 65535, options [mss 65495,sackOK,TS val 2579309207 ecr 0,nop,wscale 10], length 0
        0x0000:  4500 003c 65a4 4000 4006 d715 7f00 0001  E..<e.@.@.......
        0x0010:  7f00 0001 e750 2bcb 84c1 8c55 0000 0000  .....P+....U....
        0x0020:  a002 ffff fe30 0000 0204 ffd7 0402 080a  .....0..........
        0x0030:  99bd 2297 0000 0000 0103 030a            ..".........
20:50:41.563972 IP (tos 0x0, ttl 64, id 0, offset 0, flags [DF], proto TCP (6), length 60)
    127.0.0.1.11211 > 127.0.0.1.59216: Flags [S.], cksum 0xfe30 (incorrect -> 0xe93b), seq 1653565214, ack 2227276886, win 65535, options [mss 65495,sackOK,TS val 2579309207 ecr 2579309207,nop,wscale 10], length 0
        0x0000:  4500 003c 0000 4000 4006 3cba 7f00 0001  E..<..@.@.<.....
        0x0010:  7f00 0001 2bcb e750 628f 671e 84c1 8c56  ....+..Pb.g....V
        0x0020:  a012 ffff fe30 0000 0204 ffd7 0402 080a  .....0..........
        0x0030:  99bd 2297 99bd 2297 0103 030a            .."...".....
20:50:41.563978 IP (tos 0x0, ttl 64, id 26021, offset 0, flags [DF], proto TCP (6), length 52)
    127.0.0.1.59216 > 127.0.0.1.11211: Flags [.], cksum 0xfe28 (incorrect -> 0x11af), seq 1, ack 1, win 128, options [nop,nop,TS val 2579309207 ecr 2579309207], length 0
        0x0000:  4500 0034 65a5 4000 4006 d71c 7f00 0001  E..4e.@.@.......
        0x0010:  7f00 0001 e750 2bcb 84c1 8c56 628f 671f  .....P+....Vb.g.
        0x0020:  8010 0080 fe28 0000 0101 080a 99bd 2297  .....(........".
        0x0030:  99bd 2297                                ..".
20:50:41.563995 IP (tos 0x0, ttl 64, id 26022, offset 0, flags [DF], proto TCP (6), length 60)
    127.0.0.1.59216 > 127.0.0.1.11211: Flags [P.], cksum 0xfe30 (incorrect -> 0xbc8b), seq 1:9, ack 1, win 128, options [nop,nop,TS val 2579309207 ecr 2579309207], length 8
        0x0000:  4500 003c 65a6 4000 4006 d713 7f00 0001  E..<e.@.@.......
        0x0010:  7f00 0001 e750 2bcb 84c1 8c56 628f 671f  .....P+....Vb.g.
        0x0020:  8018 0080 fe30 0000 0101 080a 99bd 2297  .....0........".
        0x0030:  99bd 2297 7374 6174 7320 0d0a            ..".stats...
20:50:41.563997 IP (tos 0x0, ttl 64, id 27462, offset 0, flags [DF], proto TCP (6), length 52)
    127.0.0.1.11211 > 127.0.0.1.59216: Flags [.], cksum 0xfe28 (incorrect -> 0x11a7), seq 1, ack 9, win 128, options [nop,nop,TS val 2579309207 ecr 2579309207], length 0
        0x0000:  4500 0034 6b46 4000 4006 d17b 7f00 0001  E..4kF@.@..{....
        0x0010:  7f00 0001 2bcb e750 628f 671f 84c1 8c5e  ....+..Pb.g....^
        0x0020:  8010 0080 fe28 0000 0101 080a 99bd 2297  .....(........".
        0x0030:  99bd 2297                                ..".
20:50:41.564103 IP (tos 0x0, ttl 64, id 27463, offset 0, flags [DF], proto TCP (6), length 1948)
    127.0.0.1.11211 > 127.0.0.1.59216: Flags [P.], cksum 0x0591 (incorrect -> 0xffb2), seq 1:1897, ack 9, win 128, options [nop,nop,TS val 2579309207 ecr 2579309207], length 1896
        0x0000:  4500 079c 6b47 4000 4006 ca12 7f00 0001  E...kG@.@.......
        0x0010:  7f00 0001 2bcb e750 628f 671f 84c1 8c5e  ....+..Pb.g....^
        0x0020:  8018 0080 0591 0000 0101 080a 99bd 2297  ..............".
        0x0030:  99bd 2297 5354 4154 2070 6964 2033 3332  ..".STAT.pid.332
        0x0040:  340d 0a53 5441 5420 7570 7469 6d65 2032  4..STAT.uptime.2
        0x0050:  0d0a 5354 4154 2074 696d 6520 3136 3737  ..STAT.time.1677
        0x0060:  3837 3636 3431 0d0a 5354 4154 2076 6572  876641..STAT.ver
        0x0070:  7369 6f6e 2031 2e35 2e32 320d 0a53 5441  sion.1.5.22..STA
        0x0080:  5420 6c69 6265 7665 6e74 2032 2e31 2e38  T.libevent.2.1.8
        0x0090:  2d73 7461 626c 650d 0a53 5441 5420 706f  -stable..STAT.po
        0x00a0:  696e 7465 725f 7369 7a65 2036 340d 0a53  inter_size.64..S
        0x00b0:  5441 5420 7275 7361 6765 5f75 7365 7220  TAT.rusage_user.
        0x00c0:  302e 3030 3030 3030 0d0a 5354 4154 2072  0.000000..STAT.r
        0x00d0:  7573 6167 655f 7379 7374 656d 2030 2e30  usage_system.0.0
        0x00e0:  3032 3733 350d 0a53 5441 5420 6d61 785f  02735..STAT.max_
        0x00f0:  636f 6e6e 6563 7469 6f6e 7320 3130 3234  connections.1024
        0x0100:  0d0a 5354 4154 2063 7572 725f 636f 6e6e  ..STAT.curr_conn
        0x0110:  6563 7469 6f6e 7320 320d 0a53 5441 5420  ections.2..STAT.
        0x0120:  746f 7461 6c5f 636f 6e6e 6563 7469 6f6e  total_connection
        0x0130:  7320 330d 0a53 5441 5420 7265 6a65 6374  s.3..STAT.reject
        0x0140:  6564 5f63 6f6e 6e65 6374 696f 6e73 2030  ed_connections.0
        0x0150:  0d0a 5354 4154 2063 6f6e 6e65 6374 696f  ..STAT.connectio
        0x0160:  6e5f 7374 7275 6374 7572 6573 2033 0d0a  n_structures.3..
        0x0170:  5354 4154 2072 6573 6572 7665 645f 6664  STAT.reserved_fd
        0x0180:  7320 3230 0d0a 5354 4154 2063 6d64 5f67  s.20..STAT.cmd_g
        0x0190:  6574 2030 0d0a 5354 4154 2063 6d64 5f73  et.0..STAT.cmd_s
        0x01a0:  6574 2030 0d0a 5354 4154 2063 6d64 5f66  et.0..STAT.cmd_f
        0x01b0:  6c75 7368 2030 0d0a 5354 4154 2063 6d64  lush.0..STAT.cmd
        0x01c0:  5f74 6f75 6368 2030 0d0a 5354 4154 2063  _touch.0..STAT.c
        0x01d0:  6d64 5f6d 6574 6120 300d 0a53 5441 5420  md_meta.0..STAT.
        0x01e0:  6765 745f 6869 7473 2030 0d0a 5354 4154  get_hits.0..STAT
        0x01f0:  2067 6574 5f6d 6973 7365 7320 300d 0a53  .get_misses.0..S
        0x0200:  5441 5420 6765 745f 6578 7069 7265 6420  TAT.get_expired.
        0x0210:  300d 0a53 5441 5420 6765 745f 666c 7573  0..STAT.get_flus
        0x0220:  6865 6420 300d 0a53 5441 5420 6465 6c65  hed.0..STAT.dele
        0x0230:  7465 5f6d 6973 7365 7320 300d 0a53 5441  te_misses.0..STA
        0x0240:  5420 6465 6c65 7465 5f68 6974 7320 300d  T.delete_hits.0.
        0x0250:  0a53 5441 5420 696e 6372 5f6d 6973 7365  .STAT.incr_misse
        0x0260:  7320 300d 0a53 5441 5420 696e 6372 5f68  s.0..STAT.incr_h
        0x0270:  6974 7320 300d 0a53 5441 5420 6465 6372  its.0..STAT.decr
        0x0280:  5f6d 6973 7365 7320 300d 0a53 5441 5420  _misses.0..STAT.
        0x0290:  6465 6372 5f68 6974 7320 300d 0a53 5441  decr_hits.0..STA
        0x02a0:  5420 6361 735f 6d69 7373 6573 2030 0d0a  T.cas_misses.0..
        0x02b0:  5354 4154 2063 6173 5f68 6974 7320 300d  STAT.cas_hits.0.
        0x02c0:  0a53 5441 5420 6361 735f 6261 6476 616c  .STAT.cas_badval
        0x02d0:  2030 0d0a 5354 4154 2074 6f75 6368 5f68  .0..STAT.touch_h
        0x02e0:  6974 7320 300d 0a53 5441 5420 746f 7563  its.0..STAT.touc
        0x02f0:  685f 6d69 7373 6573 2030 0d0a 5354 4154  h_misses.0..STAT
        0x0300:  2061 7574 685f 636d 6473 2030 0d0a 5354  .auth_cmds.0..ST
        0x0310:  4154 2061 7574 685f 6572 726f 7273 2030  AT.auth_errors.0
        0x0320:  0d0a 5354 4154 2062 7974 6573 5f72 6561  ..STAT.bytes_rea
        0x0330:  6420 380d 0a53 5441 5420 6279 7465 735f  d.8..STAT.bytes_
        0x0340:  7772 6974 7465 6e20 300d 0a53 5441 5420  written.0..STAT.
        0x0350:  6c69 6d69 745f 6d61 7862 7974 6573 2036  limit_maxbytes.6
        0x0360:  3731 3038 3836 340d 0a53 5441 5420 6163  7108864..STAT.ac
        0x0370:  6365 7074 696e 675f 636f 6e6e 7320 310d  cepting_conns.1.
        0x0380:  0a53 5441 5420 6c69 7374 656e 5f64 6973  .STAT.listen_dis
        0x0390:  6162 6c65 645f 6e75 6d20 300d 0a53 5441  abled_num.0..STA
        0x03a0:  5420 7469 6d65 5f69 6e5f 6c69 7374 656e  T.time_in_listen
        0x03b0:  5f64 6973 6162 6c65 645f 7573 2030 0d0a  _disabled_us.0..
        0x03c0:  5354 4154 2074 6872 6561 6473 2034 0d0a  STAT.threads.4..
        0x03d0:  5354 4154 2063 6f6e 6e5f 7969 656c 6473  STAT.conn_yields
        0x03e0:  2030 0d0a 5354 4154 2068 6173 685f 706f  .0..STAT.hash_po
        0x03f0:  7765 725f 6c65 7665 6c20 3136 0d0a 5354  wer_level.16..ST
        0x0400:  4154 2068 6173 685f 6279 7465 7320 3532  AT.hash_bytes.52
        0x0410:  3432 3838 0d0a 5354 4154 2068 6173 685f  4288..STAT.hash_
        0x0420:  6973 5f65 7870 616e 6469 6e67 2030 0d0a  is_expanding.0..
        0x0430:  5354 4154 2073 6c61 625f 7265 6173 7369  STAT.slab_reassi
        0x0440:  676e 5f72 6573 6375 6573 2030 0d0a 5354  gn_rescues.0..ST
        0x0450:  4154 2073 6c61 625f 7265 6173 7369 676e  AT.slab_reassign
        0x0460:  5f63 6875 6e6b 5f72 6573 6375 6573 2030  _chunk_rescues.0
        0x0470:  0d0a 5354 4154 2073 6c61 625f 7265 6173  ..STAT.slab_reas
        0x0480:  7369 676e 5f65 7669 6374 696f 6e73 5f6e  sign_evictions_n
        0x0490:  6f6d 656d 2030 0d0a 5354 4154 2073 6c61  omem.0..STAT.sla
        0x04a0:  625f 7265 6173 7369 676e 5f69 6e6c 696e  b_reassign_inlin
        0x04b0:  655f 7265 636c 6169 6d20 300d 0a53 5441  e_reclaim.0..STA
        0x04c0:  5420 736c 6162 5f72 6561 7373 6967 6e5f  T.slab_reassign_
        0x04d0:  6275 7379 5f69 7465 6d73 2030 0d0a 5354  busy_items.0..ST
        0x04e0:  4154 2073 6c61 625f 7265 6173 7369 676e  AT.slab_reassign
        0x04f0:  5f62 7573 795f 6465 6c65 7465 7320 300d  _busy_deletes.0.
        0x0500:  0a53 5441 5420 736c 6162 5f72 6561 7373  .STAT.slab_reass
        0x0510:  6967 6e5f 7275 6e6e 696e 6720 300d 0a53  ign_running.0..S
        0x0520:  5441 5420 736c 6162 735f 6d6f 7665 6420  TAT.slabs_moved.
        0x0530:  300d 0a53 5441 5420 6c72 755f 6372 6177  0..STAT.lru_craw
        0x0540:  6c65 725f 7275 6e6e 696e 6720 300d 0a53  ler_running.0..S
        0x0550:  5441 5420 6c72 755f 6372 6177 6c65 725f  TAT.lru_crawler_
        0x0560:  7374 6172 7473 2032 3535 0d0a 5354 4154  starts.255..STAT
        0x0570:  206c 7275 5f6d 6169 6e74 6169 6e65 725f  .lru_maintainer_
        0x0580:  6a75 6767 6c65 7320 3232 0d0a 5354 4154  juggles.22..STAT
        0x0590:  206d 616c 6c6f 635f 6661 696c 7320 300d  .malloc_fails.0.
        0x05a0:  0a53 5441 5420 6c6f 675f 776f 726b 6572  .STAT.log_worker
        0x05b0:  5f64 726f 7070 6564 2030 0d0a 5354 4154  _dropped.0..STAT
        0x05c0:  206c 6f67 5f77 6f72 6b65 725f 7772 6974  .log_worker_writ
        0x05d0:  7465 6e20 300d 0a53 5441 5420 6c6f 675f  ten.0..STAT.log_
        0x05e0:  7761 7463 6865 725f 736b 6970 7065 6420  watcher_skipped.
        0x05f0:  300d 0a53 5441 5420 6c6f 675f 7761 7463  0..STAT.log_watc
        0x0600:  6865 725f 7365 6e74 2030 0d0a 5354 4154  her_sent.0..STAT
        0x0610:  2062 7974 6573 2030 0d0a 5354 4154 2063  .bytes.0..STAT.c
        0x0620:  7572 725f 6974 656d 7320 300d 0a53 5441  urr_items.0..STA
        0x0630:  5420 746f 7461 6c5f 6974 656d 7320 300d  T.total_items.0.
        0x0640:  0a53 5441 5420 736c 6162 5f67 6c6f 6261  .STAT.slab_globa
        0x0650:  6c5f 7061 6765 5f70 6f6f 6c20 300d 0a53  l_page_pool.0..S
        0x0660:  5441 5420 6578 7069 7265 645f 756e 6665  TAT.expired_unfe
        0x0670:  7463 6865 6420 300d 0a53 5441 5420 6576  tched.0..STAT.ev
        0x0680:  6963 7465 645f 756e 6665 7463 6865 6420  icted_unfetched.
        0x0690:  300d 0a53 5441 5420 6576 6963 7465 645f  0..STAT.evicted_
        0x06a0:  6163 7469 7665 2030 0d0a 5354 4154 2065  active.0..STAT.e
        0x06b0:  7669 6374 696f 6e73 2030 0d0a 5354 4154  victions.0..STAT
        0x06c0:  2072 6563 6c61 696d 6564 2030 0d0a 5354  .reclaimed.0..ST
        0x06d0:  4154 2063 7261 776c 6572 5f72 6563 6c61  AT.crawler_recla
        0x06e0:  696d 6564 2030 0d0a 5354 4154 2063 7261  imed.0..STAT.cra
        0x06f0:  776c 6572 5f69 7465 6d73 5f63 6865 636b  wler_items_check
        0x0700:  6564 2030 0d0a 5354 4154 206c 7275 7461  ed.0..STAT.lruta
        0x0710:  696c 5f72 6566 6c6f 636b 6564 2030 0d0a  il_reflocked.0..
        0x0720:  5354 4154 206d 6f76 6573 5f74 6f5f 636f  STAT.moves_to_co
        0x0730:  6c64 2030 0d0a 5354 4154 206d 6f76 6573  ld.0..STAT.moves
        0x0740:  5f74 6f5f 7761 726d 2030 0d0a 5354 4154  _to_warm.0..STAT
        0x0750:  206d 6f76 6573 5f77 6974 6869 6e5f 6c72  .moves_within_lr
        0x0760:  7520 300d 0a53 5441 5420 6469 7265 6374  u.0..STAT.direct
        0x0770:  5f72 6563 6c61 696d 7320 300d 0a53 5441  _reclaims.0..STA
        0x0780:  5420 6c72 755f 6275 6d70 735f 6472 6f70  T.lru_bumps_drop
        0x0790:  7065 6420 300d 0a45 4e44 0d0a            ped.0..END..
20:50:41.564107 IP (tos 0x0, ttl 64, id 26023, offset 0, flags [DF], proto TCP (6), length 52)
    127.0.0.1.59216 > 127.0.0.1.11211: Flags [.], cksum 0xfe28 (incorrect -> 0x09bf), seq 9, ack 1897, win 256, options [nop,nop,TS val 2579309207 ecr 2579309207], length 0
        0x0000:  4500 0034 65a7 4000 4006 d71a 7f00 0001  E..4e.@.@.......
        0x0010:  7f00 0001 e750 2bcb 84c1 8c5e 628f 6e87  .....P+....^b.n.
        0x0020:  8010 0100 fe28 0000 0101 080a 99bd 2297  .....(........".
        0x0030:  99bd 2297                                ..".
20:50:41.564164 IP (tos 0x0, ttl 64, id 26024, offset 0, flags [DF], proto TCP (6), length 58)
    127.0.0.1.59216 > 127.0.0.1.11211: Flags [P.], cksum 0xfe2e (incorrect -> 0x21bc), seq 9:15, ack 1897, win 256, options [nop,nop,TS val 2579309208 ecr 2579309207], length 6
        0x0000:  4500 003a 65a8 4000 4006 d713 7f00 0001  E..:e.@.@.......
        0x0010:  7f00 0001 e750 2bcb 84c1 8c5e 628f 6e87  .....P+....^b.n.
        0x0020:  8018 0100 fe2e 0000 0101 080a 99bd 2298  ..............".
        0x0030:  99bd 2297 7175 6974 0d0a                 ..".quit..
20:50:41.564169 IP (tos 0x0, ttl 64, id 26025, offset 0, flags [DF], proto TCP (6), length 52)
    127.0.0.1.59216 > 127.0.0.1.11211: Flags [F.], cksum 0xfe28 (incorrect -> 0x09b7), seq 15, ack 1897, win 256, options [nop,nop,TS val 2579309208 ecr 2579309207], length 0
        0x0000:  4500 0034 65a9 4000 4006 d718 7f00 0001  E..4e.@.@.......
        0x0010:  7f00 0001 e750 2bcb 84c1 8c64 628f 6e87  .....P+....db.n.
        0x0020:  8011 0100 fe28 0000 0101 080a 99bd 2298  .....(........".
        0x0030:  99bd 2297                                ..".
20:50:41.564173 IP (tos 0x0, ttl 64, id 27464, offset 0, flags [DF], proto TCP (6), length 52)
    127.0.0.1.11211 > 127.0.0.1.59216: Flags [F.], cksum 0xfe28 (incorrect -> 0x0a35), seq 1897, ack 16, win 128, options [nop,nop,TS val 2579309208 ecr 2579309208], length 0
        0x0000:  4500 0034 6b48 4000 4006 d179 7f00 0001  E..4kH@.@..y....
        0x0010:  7f00 0001 2bcb e750 628f 6e87 84c1 8c65  ....+..Pb.n....e
        0x0020:  8011 0080 fe28 0000 0101 080a 99bd 2298  .....(........".
        0x0030:  99bd 2298                                ..".
20:50:41.564180 IP (tos 0x0, ttl 64, id 26026, offset 0, flags [DF], proto TCP (6), length 52)
    127.0.0.1.59216 > 127.0.0.1.11211: Flags [.], cksum 0xfe28 (incorrect -> 0x09b5), seq 16, ack 1898, win 256, options [nop,nop,TS val 2579309208 ecr 2579309208], length 0
        0x0000:  4500 0034 65aa 4000 4006 d717 7f00 0001  E..4e.@.@.......
        0x0010:  7f00 0001 e750 2bcb 84c1 8c65 628f 6e88  .....P+....eb.n.
        0x0020:  8010 0100 fe28 0000 0101 080a 99bd 2298  .....(........".
        0x0030:  99bd 2298                                ..".
20:50:41.564196 IP (tos 0x0, ttl 64, id 15104, offset 0, flags [DF], proto TCP (6), length 60)
    127.0.0.1.59218 > 127.0.0.1.11211: Flags [S], cksum 0xfe30 (incorrect -> 0xe317), seq 1836658642, win 65535, options [mss 65495,sackOK,TS val 2579309208 ecr 0,nop,wscale 10], length 0
        0x0000:  4500 003c 3b00 4000 4006 01ba 7f00 0001  E..<;.@.@.......
        0x0010:  7f00 0001 e752 2bcb 6d79 2fd2 0000 0000  .....R+.my/.....
        0x0020:  a002 ffff fe30 0000 0204 ffd7 0402 080a  .....0..........
        0x0030:  99bd 2298 0000 0000 0103 030a            ..".........
20:50:41.564199 IP (tos 0x0, ttl 64, id 0, offset 0, flags [DF], proto TCP (6), length 60)
    127.0.0.1.11211 > 127.0.0.1.59218: Flags [S.], cksum 0xfe30 (incorrect -> 0xe307), seq 3878968436, ack 1836658643, win 65535, options [mss 65495,sackOK,TS val 2579309208 ecr 2579309208,nop,wscale 10], length 0
        0x0000:  4500 003c 0000 4000 4006 3cba 7f00 0001  E..<..@.@.<.....
        0x0010:  7f00 0001 2bcb e752 e734 5c74 6d79 2fd3  ....+..R.4\tmy/.
        0x0020:  a012 ffff fe30 0000 0204 ffd7 0402 080a  .....0..........
        0x0030:  99bd 2298 99bd 2298 0103 030a            .."...".....
20:50:41.564201 IP (tos 0x0, ttl 64, id 15105, offset 0, flags [DF], proto TCP (6), length 52)
    127.0.0.1.59218 > 127.0.0.1.11211: Flags [.], cksum 0xfe28 (incorrect -> 0x0b7b), seq 1, ack 1, win 128, options [nop,nop,TS val 2579309208 ecr 2579309208], length 0
        0x0000:  4500 0034 3b01 4000 4006 01c1 7f00 0001  E..4;.@.@.......
        0x0010:  7f00 0001 e752 2bcb 6d79 2fd3 e734 5c75  .....R+.my/..4\u
        0x0020:  8010 0080 fe28 0000 0101 080a 99bd 2298  .....(........".
        0x0030:  99bd 2298                                ..".
20:50:41.564209 IP (tos 0x0, ttl 64, id 15106, offset 0, flags [DF], proto TCP (6), length 60)
    127.0.0.1.59218 > 127.0.0.1.11211: Flags [P.], cksum 0xfe30 (incorrect -> 0xb657), seq 1:9, ack 1, win 128, options [nop,nop,TS val 2579309208 ecr 2579309208], length 8
        0x0000:  4500 003c 3b02 4000 4006 01b8 7f00 0001  E..<;.@.@.......
        0x0010:  7f00 0001 e752 2bcb 6d79 2fd3 e734 5c75  .....R+.my/..4\u
        0x0020:  8018 0080 fe30 0000 0101 080a 99bd 2298  .....0........".
        0x0030:  99bd 2298 7374 6174 7320 0d0a            ..".stats...
20:50:41.564210 IP (tos 0x0, ttl 64, id 49947, offset 0, flags [DF], proto TCP (6), length 52)
    127.0.0.1.11211 > 127.0.0.1.59218: Flags [.], cksum 0xfe28 (incorrect -> 0x0b73), seq 1, ack 9, win 128, options [nop,nop,TS val 2579309208 ecr 2579309208], length 0
        0x0000:  4500 0034 c31b 4000 4006 79a6 7f00 0001  E..4..@.@.y.....
        0x0010:  7f00 0001 2bcb e752 e734 5c75 6d79 2fdb  ....+..R.4\umy/.
        0x0020:  8010 0080 fe28 0000 0101 080a 99bd 2298  .....(........".
        0x0030:  99bd 2298                                ..".
20:50:41.564324 IP (tos 0x0, ttl 64, id 49948, offset 0, flags [DF], proto TCP (6), length 1952)
    127.0.0.1.11211 > 127.0.0.1.59218: Flags [P.], cksum 0x0595 (incorrect -> 0x1687), seq 1:1901, ack 9, win 128, options [nop,nop,TS val 2579309208 ecr 2579309208], length 1900
        0x0000:  4500 07a0 c31c 4000 4006 7239 7f00 0001  E.....@.@.r9....
        0x0010:  7f00 0001 2bcb e752 e734 5c75 6d79 2fdb  ....+..R.4\umy/.
        0x0020:  8018 0080 0595 0000 0101 080a 99bd 2298  ..............".
        0x0030:  99bd 2298 5354 4154 2070 6964 2033 3332  ..".STAT.pid.332
        0x0040:  340d 0a53 5441 5420 7570 7469 6d65 2032  4..STAT.uptime.2
        0x0050:  0d0a 5354 4154 2074 696d 6520 3136 3737  ..STAT.time.1677
        0x0060:  3837 3636 3431 0d0a 5354 4154 2076 6572  876641..STAT.ver
        0x0070:  7369 6f6e 2031 2e35 2e32 320d 0a53 5441  sion.1.5.22..STA
        0x0080:  5420 6c69 6265 7665 6e74 2032 2e31 2e38  T.libevent.2.1.8
        0x0090:  2d73 7461 626c 650d 0a53 5441 5420 706f  -stable..STAT.po
        0x00a0:  696e 7465 725f 7369 7a65 2036 340d 0a53  inter_size.64..S
        0x00b0:  5441 5420 7275 7361 6765 5f75 7365 7220  TAT.rusage_user.
        0x00c0:  302e 3030 3030 3030 0d0a 5354 4154 2072  0.000000..STAT.r
        0x00d0:  7573 6167 655f 7379 7374 656d 2030 2e30  usage_system.0.0
        0x00e0:  3032 3837 310d 0a53 5441 5420 6d61 785f  02871..STAT.max_
        0x00f0:  636f 6e6e 6563 7469 6f6e 7320 3130 3234  connections.1024
        0x0100:  0d0a 5354 4154 2063 7572 725f 636f 6e6e  ..STAT.curr_conn
        0x0110:  6563 7469 6f6e 7320 320d 0a53 5441 5420  ections.2..STAT.
        0x0120:  746f 7461 6c5f 636f 6e6e 6563 7469 6f6e  total_connection
        0x0130:  7320 340d 0a53 5441 5420 7265 6a65 6374  s.4..STAT.reject
        0x0140:  6564 5f63 6f6e 6e65 6374 696f 6e73 2030  ed_connections.0
        0x0150:  0d0a 5354 4154 2063 6f6e 6e65 6374 696f  ..STAT.connectio
        0x0160:  6e5f 7374 7275 6374 7572 6573 2033 0d0a  n_structures.3..
        0x0170:  5354 4154 2072 6573 6572 7665 645f 6664  STAT.reserved_fd
        0x0180:  7320 3230 0d0a 5354 4154 2063 6d64 5f67  s.20..STAT.cmd_g
        0x0190:  6574 2030 0d0a 5354 4154 2063 6d64 5f73  et.0..STAT.cmd_s
        0x01a0:  6574 2030 0d0a 5354 4154 2063 6d64 5f66  et.0..STAT.cmd_f
        0x01b0:  6c75 7368 2030 0d0a 5354 4154 2063 6d64  lush.0..STAT.cmd
        0x01c0:  5f74 6f75 6368 2030 0d0a 5354 4154 2063  _touch.0..STAT.c
        0x01d0:  6d64 5f6d 6574 6120 300d 0a53 5441 5420  md_meta.0..STAT.
        0x01e0:  6765 745f 6869 7473 2030 0d0a 5354 4154  get_hits.0..STAT
        0x01f0:  2067 6574 5f6d 6973 7365 7320 300d 0a53  .get_misses.0..S
        0x0200:  5441 5420 6765 745f 6578 7069 7265 6420  TAT.get_expired.
        0x0210:  300d 0a53 5441 5420 6765 745f 666c 7573  0..STAT.get_flus
        0x0220:  6865 6420 300d 0a53 5441 5420 6465 6c65  hed.0..STAT.dele
        0x0230:  7465 5f6d 6973 7365 7320 300d 0a53 5441  te_misses.0..STA
        0x0240:  5420 6465 6c65 7465 5f68 6974 7320 300d  T.delete_hits.0.
        0x0250:  0a53 5441 5420 696e 6372 5f6d 6973 7365  .STAT.incr_misse
        0x0260:  7320 300d 0a53 5441 5420 696e 6372 5f68  s.0..STAT.incr_h
        0x0270:  6974 7320 300d 0a53 5441 5420 6465 6372  its.0..STAT.decr
        0x0280:  5f6d 6973 7365 7320 300d 0a53 5441 5420  _misses.0..STAT.
        0x0290:  6465 6372 5f68 6974 7320 300d 0a53 5441  decr_hits.0..STA
        0x02a0:  5420 6361 735f 6d69 7373 6573 2030 0d0a  T.cas_misses.0..
        0x02b0:  5354 4154 2063 6173 5f68 6974 7320 300d  STAT.cas_hits.0.
        0x02c0:  0a53 5441 5420 6361 735f 6261 6476 616c  .STAT.cas_badval
        0x02d0:  2030 0d0a 5354 4154 2074 6f75 6368 5f68  .0..STAT.touch_h
        0x02e0:  6974 7320 300d 0a53 5441 5420 746f 7563  its.0..STAT.touc
        0x02f0:  685f 6d69 7373 6573 2030 0d0a 5354 4154  h_misses.0..STAT
        0x0300:  2061 7574 685f 636d 6473 2030 0d0a 5354  .auth_cmds.0..ST
        0x0310:  4154 2061 7574 685f 6572 726f 7273 2030  AT.auth_errors.0
        0x0320:  0d0a 5354 4154 2062 7974 6573 5f72 6561  ..STAT.bytes_rea
        0x0330:  6420 3232 0d0a 5354 4154 2062 7974 6573  d.22..STAT.bytes
        0x0340:  5f77 7269 7474 656e 2031 3839 360d 0a53  _written.1896..S
        0x0350:  5441 5420 6c69 6d69 745f 6d61 7862 7974  TAT.limit_maxbyt
        0x0360:  6573 2036 3731 3038 3836 340d 0a53 5441  es.67108864..STA
        0x0370:  5420 6163 6365 7074 696e 675f 636f 6e6e  T.accepting_conn
        0x0380:  7320 310d 0a53 5441 5420 6c69 7374 656e  s.1..STAT.listen
        0x0390:  5f64 6973 6162 6c65 645f 6e75 6d20 300d  _disabled_num.0.
        0x03a0:  0a53 5441 5420 7469 6d65 5f69 6e5f 6c69  .STAT.time_in_li
        0x03b0:  7374 656e 5f64 6973 6162 6c65 645f 7573  sten_disabled_us
        0x03c0:  2030 0d0a 5354 4154 2074 6872 6561 6473  .0..STAT.threads
        0x03d0:  2034 0d0a 5354 4154 2063 6f6e 6e5f 7969  .4..STAT.conn_yi
        0x03e0:  656c 6473 2030 0d0a 5354 4154 2068 6173  elds.0..STAT.has
        0x03f0:  685f 706f 7765 725f 6c65 7665 6c20 3136  h_power_level.16
        0x0400:  0d0a 5354 4154 2068 6173 685f 6279 7465  ..STAT.hash_byte
        0x0410:  7320 3532 3432 3838 0d0a 5354 4154 2068  s.524288..STAT.h
        0x0420:  6173 685f 6973 5f65 7870 616e 6469 6e67  ash_is_expanding
        0x0430:  2030 0d0a 5354 4154 2073 6c61 625f 7265  .0..STAT.slab_re
        0x0440:  6173 7369 676e 5f72 6573 6375 6573 2030  assign_rescues.0
        0x0450:  0d0a 5354 4154 2073 6c61 625f 7265 6173  ..STAT.slab_reas
        0x0460:  7369 676e 5f63 6875 6e6b 5f72 6573 6375  sign_chunk_rescu
        0x0470:  6573 2030 0d0a 5354 4154 2073 6c61 625f  es.0..STAT.slab_
        0x0480:  7265 6173 7369 676e 5f65 7669 6374 696f  reassign_evictio
        0x0490:  6e73 5f6e 6f6d 656d 2030 0d0a 5354 4154  ns_nomem.0..STAT
        0x04a0:  2073 6c61 625f 7265 6173 7369 676e 5f69  .slab_reassign_i
        0x04b0:  6e6c 696e 655f 7265 636c 6169 6d20 300d  nline_reclaim.0.
        0x04c0:  0a53 5441 5420 736c 6162 5f72 6561 7373  .STAT.slab_reass
        0x04d0:  6967 6e5f 6275 7379 5f69 7465 6d73 2030  ign_busy_items.0
        0x04e0:  0d0a 5354 4154 2073 6c61 625f 7265 6173  ..STAT.slab_reas
        0x04f0:  7369 676e 5f62 7573 795f 6465 6c65 7465  sign_busy_delete
        0x0500:  7320 300d 0a53 5441 5420 736c 6162 5f72  s.0..STAT.slab_r
        0x0510:  6561 7373 6967 6e5f 7275 6e6e 696e 6720  eassign_running.
        0x0520:  300d 0a53 5441 5420 736c 6162 735f 6d6f  0..STAT.slabs_mo
        0x0530:  7665 6420 300d 0a53 5441 5420 6c72 755f  ved.0..STAT.lru_
        0x0540:  6372 6177 6c65 725f 7275 6e6e 696e 6720  crawler_running.
        0x0550:  300d 0a53 5441 5420 6c72 755f 6372 6177  0..STAT.lru_craw
        0x0560:  6c65 725f 7374 6172 7473 2032 3535 0d0a  ler_starts.255..
        0x0570:  5354 4154 206c 7275 5f6d 6169 6e74 6169  STAT.lru_maintai
        0x0580:  6e65 725f 6a75 6767 6c65 7320 3232 0d0a  ner_juggles.22..
        0x0590:  5354 4154 206d 616c 6c6f 635f 6661 696c  STAT.malloc_fail
        0x05a0:  7320 300d 0a53 5441 5420 6c6f 675f 776f  s.0..STAT.log_wo
        0x05b0:  726b 6572 5f64 726f 7070 6564 2030 0d0a  rker_dropped.0..
        0x05c0:  5354 4154 206c 6f67 5f77 6f72 6b65 725f  STAT.log_worker_
        0x05d0:  7772 6974 7465 6e20 300d 0a53 5441 5420  written.0..STAT.
        0x05e0:  6c6f 675f 7761 7463 6865 725f 736b 6970  log_watcher_skip
        0x05f0:  7065 6420 300d 0a53 5441 5420 6c6f 675f  ped.0..STAT.log_
        0x0600:  7761 7463 6865 725f 7365 6e74 2030 0d0a  watcher_sent.0..
        0x0610:  5354 4154 2062 7974 6573 2030 0d0a 5354  STAT.bytes.0..ST
        0x0620:  4154 2063 7572 725f 6974 656d 7320 300d  AT.curr_items.0.
        0x0630:  0a53 5441 5420 746f 7461 6c5f 6974 656d  .STAT.total_item
        0x0640:  7320 300d 0a53 5441 5420 736c 6162 5f67  s.0..STAT.slab_g
        0x0650:  6c6f 6261 6c5f 7061 6765 5f70 6f6f 6c20  lobal_page_pool.
        0x0660:  300d 0a53 5441 5420 6578 7069 7265 645f  0..STAT.expired_
        0x0670:  756e 6665 7463 6865 6420 300d 0a53 5441  unfetched.0..STA
        0x0680:  5420 6576 6963 7465 645f 756e 6665 7463  T.evicted_unfetc
        0x0690:  6865 6420 300d 0a53 5441 5420 6576 6963  hed.0..STAT.evic
        0x06a0:  7465 645f 6163 7469 7665 2030 0d0a 5354  ted_active.0..ST
        0x06b0:  4154 2065 7669 6374 696f 6e73 2030 0d0a  AT.evictions.0..
        0x06c0:  5354 4154 2072 6563 6c61 696d 6564 2030  STAT.reclaimed.0
        0x06d0:  0d0a 5354 4154 2063 7261 776c 6572 5f72  ..STAT.crawler_r
        0x06e0:  6563 6c61 696d 6564 2030 0d0a 5354 4154  eclaimed.0..STAT
        0x06f0:  2063 7261 776c 6572 5f69 7465 6d73 5f63  .crawler_items_c
        0x0700:  6865 636b 6564 2030 0d0a 5354 4154 206c  hecked.0..STAT.l
        0x0710:  7275 7461 696c 5f72 6566 6c6f 636b 6564  rutail_reflocked
        0x0720:  2030 0d0a 5354 4154 206d 6f76 6573 5f74  .0..STAT.moves_t
        0x0730:  6f5f 636f 6c64 2030 0d0a 5354 4154 206d  o_cold.0..STAT.m
        0x0740:  6f76 6573 5f74 6f5f 7761 726d 2030 0d0a  oves_to_warm.0..
        0x0750:  5354 4154 206d 6f76 6573 5f77 6974 6869  STAT.moves_withi
        0x0760:  6e5f 6c72 7520 300d 0a53 5441 5420 6469  n_lru.0..STAT.di
        0x0770:  7265 6374 5f72 6563 6c61 696d 7320 300d  rect_reclaims.0.
        0x0780:  0a53 5441 5420 6c72 755f 6275 6d70 735f  .STAT.lru_bumps_
        0x0790:  6472 6f70 7065 6420 300d 0a45 4e44 0d0a  dropped.0..END..
20:50:41.564330 IP (tos 0x0, ttl 64, id 15107, offset 0, flags [DF], proto TCP (6), length 52)
    127.0.0.1.59218 > 127.0.0.1.11211: Flags [.], cksum 0xfe28 (incorrect -> 0x0387), seq 9, ack 1901, win 256, options [nop,nop,TS val 2579309208 ecr 2579309208], length 0
        0x0000:  4500 0034 3b03 4000 4006 01bf 7f00 0001  E..4;.@.@.......
        0x0010:  7f00 0001 e752 2bcb 6d79 2fdb e734 63e1  .....R+.my/..4c.
        0x0020:  8010 0100 fe28 0000 0101 080a 99bd 2298  .....(........".
        0x0030:  99bd 2298                                ..".
20:50:41.564444 IP (tos 0x0, ttl 64, id 15108, offset 0, flags [DF], proto TCP (6), length 58)
    127.0.0.1.59218 > 127.0.0.1.11211: Flags [P.], cksum 0xfe2e (incorrect -> 0x1b85), seq 9:15, ack 1901, win 256, options [nop,nop,TS val 2579309208 ecr 2579309208], length 6
        0x0000:  4500 003a 3b04 4000 4006 01b8 7f00 0001  E..:;.@.@.......
        0x0010:  7f00 0001 e752 2bcb 6d79 2fdb e734 63e1  .....R+.my/..4c.
        0x0020:  8018 0100 fe2e 0000 0101 080a 99bd 2298  ..............".
        0x0030:  99bd 2298 7175 6974 0d0a                 ..".quit..
20:50:41.564451 IP (tos 0x0, ttl 64, id 15109, offset 0, flags [DF], proto TCP (6), length 52)
    127.0.0.1.59218 > 127.0.0.1.11211: Flags [F.], cksum 0xfe28 (incorrect -> 0x0380), seq 15, ack 1901, win 256, options [nop,nop,TS val 2579309208 ecr 2579309208], length 0
        0x0000:  4500 0034 3b05 4000 4006 01bd 7f00 0001  E..4;.@.@.......
        0x0010:  7f00 0001 e752 2bcb 6d79 2fe1 e734 63e1  .....R+.my/..4c.
        0x0020:  8011 0100 fe28 0000 0101 080a 99bd 2298  .....(........".
        0x0030:  99bd 2298                                ..".
20:50:41.564474 IP (tos 0x0, ttl 64, id 49949, offset 0, flags [DF], proto TCP (6), length 52)
    127.0.0.1.11211 > 127.0.0.1.59218: Flags [F.], cksum 0xfe28 (incorrect -> 0x03ff), seq 1901, ack 16, win 128, options [nop,nop,TS val 2579309208 ecr 2579309208], length 0
        0x0000:  4500 0034 c31d 4000 4006 79a4 7f00 0001  E..4..@.@.y.....
        0x0010:  7f00 0001 2bcb e752 e734 63e1 6d79 2fe2  ....+..R.4c.my/.
        0x0020:  8011 0080 fe28 0000 0101 080a 99bd 2298  .....(........".
        0x0030:  99bd 2298                                ..".
20:50:41.564484 IP (tos 0x0, ttl 64, id 15110, offset 0, flags [DF], proto TCP (6), length 52)
    127.0.0.1.59218 > 127.0.0.1.11211: Flags [.], cksum 0xfe28 (incorrect -> 0x037f), seq 16, ack 1902, win 256, options [nop,nop,TS val 2579309208 ecr 2579309208], length 0
        0x0000:  4500 0034 3b06 4000 4006 01bc 7f00 0001  E..4;.@.@.......
        0x0010:  7f00 0001 e752 2bcb 6d79 2fe2 e734 63e2  .....R+.my/..4c.
        0x0020:  8010 0100 fe28 0000 0101 080a 99bd 2298  .....(........".
        0x0030:  99bd 2298                                ..".
20:50:41.564568 IP (tos 0x0, ttl 64, id 21524, offset 0, flags [DF], proto TCP (6), length 60)
    127.0.0.1.59220 > 127.0.0.1.11211: Flags [S], cksum 0xfe30 (incorrect -> 0x9a5e), seq 964537477, win 65535, options [mss 65495,sackOK,TS val 2579309208 ecr 0,nop,wscale 10], length 0
        0x0000:  4500 003c 5414 4000 4006 e8a5 7f00 0001  E..<T.@.@.......
        0x0010:  7f00 0001 e754 2bcb 397d ac85 0000 0000  .....T+.9}......
        0x0020:  a002 ffff fe30 0000 0204 ffd7 0402 080a  .....0..........
        0x0030:  99bd 2298 0000 0000 0103 030a            ..".........
20:50:41.564573 IP (tos 0x0, ttl 64, id 0, offset 0, flags [DF], proto TCP (6), length 60)
    127.0.0.1.11211 > 127.0.0.1.59220: Flags [S.], cksum 0xfe30 (incorrect -> 0x81bc), seq 2064048436, ack 964537478, win 65535, options [mss 65495,sackOK,TS val 2579309208 ecr 2579309208,nop,wscale 10], length 0
        0x0000:  4500 003c 0000 4000 4006 3cba 7f00 0001  E..<..@.@.<.....
        0x0010:  7f00 0001 2bcb e754 7b06 e134 397d ac86  ....+..T{..49}..
        0x0020:  a012 ffff fe30 0000 0204 ffd7 0402 080a  .....0..........
        0x0030:  99bd 2298 99bd 2298 0103 030a            .."...".....
20:50:41.564576 IP (tos 0x0, ttl 64, id 21525, offset 0, flags [DF], proto TCP (6), length 52)
    127.0.0.1.59220 > 127.0.0.1.11211: Flags [.], cksum 0xfe28 (incorrect -> 0xaa2f), seq 1, ack 1, win 128, options [nop,nop,TS val 2579309208 ecr 2579309208], length 0
        0x0000:  4500 0034 5415 4000 4006 e8ac 7f00 0001  E..4T.@.@.......
        0x0010:  7f00 0001 e754 2bcb 397d ac86 7b06 e135  .....T+.9}..{..5
        0x0020:  8010 0080 fe28 0000 0101 080a 99bd 2298  .....(........".
        0x0030:  99bd 2298                                ..".
20:50:41.564587 IP (tos 0x0, ttl 64, id 21526, offset 0, flags [DF], proto TCP (6), length 80)
    127.0.0.1.59220 > 127.0.0.1.11211: Flags [P.], cksum 0xfe44 (incorrect -> 0x25fe), seq 1:29, ack 1, win 128, options [nop,nop,TS val 2579309208 ecr 2579309208], length 28
        0x0000:  4500 0050 5416 4000 4006 e88f 7f00 0001  E..PT.@.@.......
        0x0010:  7f00 0001 e754 2bcb 397d ac86 7b06 e135  .....T+.9}..{..5
        0x0020:  8018 0080 fe44 0000 0101 080a 99bd 2298  .....D........".
        0x0030:  99bd 2298 8008 0000 0400 0000 0000 0004  ..".............
        0x0040:  0001 0000 0000 0000 0000 0000 0000 0000  ................
20:50:41.564588 IP (tos 0x0, ttl 64, id 61620, offset 0, flags [DF], proto TCP (6), length 52)
    127.0.0.1.11211 > 127.0.0.1.59220: Flags [.], cksum 0xfe28 (incorrect -> 0xaa13), seq 1, ack 29, win 128, options [nop,nop,TS val 2579309208 ecr 2579309208], length 0
        0x0000:  4500 0034 f0b4 4000 4006 4c0d 7f00 0001  E..4..@.@.L.....
        0x0010:  7f00 0001 2bcb e754 7b06 e135 397d aca2  ....+..T{..59}..
        0x0020:  8010 0080 fe28 0000 0101 080a 99bd 2298  .....(........".
        0x0030:  99bd 2298                                ..".
20:50:41.564617 IP (tos 0x0, ttl 64, id 61621, offset 0, flags [DF], proto TCP (6), length 76)
    127.0.0.1.11211 > 127.0.0.1.59220: Flags [P.], cksum 0xfe40 (incorrect -> 0x28ea), seq 1:25, ack 29, win 128, options [nop,nop,TS val 2579309208 ecr 2579309208], length 24
        0x0000:  4500 004c f0b5 4000 4006 4bf4 7f00 0001  E..L..@.@.K.....
        0x0010:  7f00 0001 2bcb e754 7b06 e135 397d aca2  ....+..T{..59}..
        0x0020:  8018 0080 fe40 0000 0101 080a 99bd 2298  .....@........".
        0x0030:  99bd 2298 8108 0000 0000 0000 0000 0000  ..".............
        0x0040:  0001 0000 0000 0000 0000 0000            ............
20:50:41.564624 IP (tos 0x0, ttl 64, id 21527, offset 0, flags [DF], proto TCP (6), length 52)
    127.0.0.1.59220 > 127.0.0.1.11211: Flags [.], cksum 0xfe28 (incorrect -> 0xa9fb), seq 29, ack 25, win 128, options [nop,nop,TS val 2579309208 ecr 2579309208], length 0
        0x0000:  4500 0034 5417 4000 4006 e8aa 7f00 0001  E..4T.@.@.......
        0x0010:  7f00 0001 e754 2bcb 397d aca2 7b06 e14d  .....T+.9}..{..M
        0x0020:  8010 0080 fe28 0000 0101 080a 99bd 2298  .....(........".
        0x0030:  99bd 2298                                ..".
20:50:51.564855 IP (tos 0x0, ttl 64, id 21528, offset 0, flags [DF], proto TCP (6), length 84)
    127.0.0.1.59220 > 127.0.0.1.11211: Flags [P.], cksum 0xfe48 (incorrect -> 0x55e5), seq 29:61, ack 25, win 128, options [nop,nop,TS val 2579319208 ecr 2579309208], length 32
        0x0000:  4500 0054 5418 4000 4006 e889 7f00 0001  E..TT.@.@.......
        0x0010:  7f00 0001 e754 2bcb 397d aca2 7b06 e14d  .....T+.9}..{..M
        0x0020:  8018 0080 fe48 0000 0101 080a 99bd 49a8  .....H........I.
        0x0030:  99bd 2298 800d 0008 0000 0000 0000 0008  ..".............
        0x0040:  0002 0000 0000 0000 0000 0000 7465 7374  ............test
        0x0050:  5f6b 6579                                _key
20:50:51.605253 IP (tos 0x0, ttl 64, id 61622, offset 0, flags [DF], proto TCP (6), length 52)
    127.0.0.1.11211 > 127.0.0.1.59220: Flags [.], cksum 0xfe28 (incorrect -> 0x5b92), seq 25, ack 61, win 128, options [nop,nop,TS val 2579319249 ecr 2579319208], length 0
        0x0000:  4500 0034 f0b6 4000 4006 4c0b 7f00 0001  E..4..@.@.L.....
        0x0010:  7f00 0001 2bcb e754 7b06 e14d 397d acc2  ....+..T{..M9}..
        0x0020:  8010 0080 fe28 0000 0101 080a 99bd 49d1  .....(........I.
        0x0030:  99bd 49a8                                ..I.
20:50:51.605258 IP (tos 0x0, ttl 64, id 21529, offset 0, flags [DF], proto TCP (6), length 76)
    127.0.0.1.59220 > 127.0.0.1.11211: Flags [P.], cksum 0xfe40 (incorrect -> 0xdb3b), seq 61:85, ack 25, win 128, options [nop,nop,TS val 2579319249 ecr 2579319249], length 24
        0x0000:  4500 004c 5419 4000 4006 e890 7f00 0001  E..LT.@.@.......
        0x0010:  7f00 0001 e754 2bcb 397d acc2 7b06 e14d  .....T+.9}..{..M
        0x0020:  8018 0080 fe40 0000 0101 080a 99bd 49d1  .....@........I.
        0x0030:  99bd 49d1 800a 0000 0000 0000 0000 0000  ..I.............
        0x0040:  0003 0000 0000 0000 0000 0000            ............
20:50:51.605261 IP (tos 0x0, ttl 64, id 61623, offset 0, flags [DF], proto TCP (6), length 52)
    127.0.0.1.11211 > 127.0.0.1.59220: Flags [.], cksum 0xfe28 (incorrect -> 0x5b51), seq 25, ack 85, win 128, options [nop,nop,TS val 2579319249 ecr 2579319249], length 0
        0x0000:  4500 0034 f0b7 4000 4006 4c0a 7f00 0001  E..4..@.@.L.....
        0x0010:  7f00 0001 2bcb e754 7b06 e14d 397d acda  ....+..T{..M9}..
        0x0020:  8010 0080 fe28 0000 0101 080a 99bd 49d1  .....(........I.
        0x0030:  99bd 49d1                                ..I.
20:50:51.605279 IP (tos 0x0, ttl 64, id 61624, offset 0, flags [DF], proto TCP (6), length 76)
    127.0.0.1.11211 > 127.0.0.1.59220: Flags [P.], cksum 0xfe40 (incorrect -> 0xda23), seq 25:49, ack 85, win 128, options [nop,nop,TS val 2579319249 ecr 2579319249], length 24
        0x0000:  4500 004c f0b8 4000 4006 4bf1 7f00 0001  E..L..@.@.K.....
        0x0010:  7f00 0001 2bcb e754 7b06 e14d 397d acda  ....+..T{..M9}..
        0x0020:  8018 0080 fe40 0000 0101 080a 99bd 49d1  .....@........I.
        0x0030:  99bd 49d1 810a 0000 0000 0000 0000 0000  ..I.............
        0x0040:  0003 0000 0000 0000 0000 0000            ............
20:50:51.605283 IP (tos 0x0, ttl 64, id 21530, offset 0, flags [DF], proto TCP (6), length 52)
    127.0.0.1.59220 > 127.0.0.1.11211: Flags [.], cksum 0xfe28 (incorrect -> 0x5b39), seq 85, ack 49, win 128, options [nop,nop,TS val 2579319249 ecr 2579319249], length 0
        0x0000:  4500 0034 541a 4000 4006 e8a7 7f00 0001  E..4T.@.@.......
        0x0010:  7f00 0001 e754 2bcb 397d acda 7b06 e165  .....T+.9}..{..e
        0x0020:  8010 0080 fe28 0000 0101 080a 99bd 49d1  .....(........I.
        0x0030:  99bd 49d1                                ..I.
20:50:51.605300 IP (tos 0x0, ttl 64, id 21531, offset 0, flags [DF], proto TCP (6), length 76)
    127.0.0.1.59220 > 127.0.0.1.11211: Flags [P.], cksum 0xfe40 (incorrect -> 0xdb0d), seq 85:109, ack 49, win 128, options [nop,nop,TS val 2579319249 ecr 2579319249], length 24
        0x0000:  4500 004c 541b 4000 4006 e88e 7f00 0001  E..LT.@.@.......
        0x0010:  7f00 0001 e754 2bcb 397d acda 7b06 e165  .....T+.9}..{..e
        0x0020:  8018 0080 fe40 0000 0101 080a 99bd 49d1  .....@........I.
        0x0030:  99bd 49d1 8007 0000 0000 0000 0000 0000  ..I.............
        0x0040:  0004 0000 0000 0000 0000 0000            ............
20:50:51.605308 IP (tos 0x0, ttl 64, id 21532, offset 0, flags [DF], proto TCP (6), length 52)
    127.0.0.1.59220 > 127.0.0.1.11211: Flags [F.], cksum 0xfe28 (incorrect -> 0x5b20), seq 109, ack 49, win 128, options [nop,nop,TS val 2579319249 ecr 2579319249], length 0
        0x0000:  4500 0034 541c 4000 4006 e8a5 7f00 0001  E..4T.@.@.......
        0x0010:  7f00 0001 e754 2bcb 397d acf2 7b06 e165  .....T+.9}..{..e
        0x0020:  8011 0080 fe28 0000 0101 080a 99bd 49d1  .....(........I.
        0x0030:  99bd 49d1                                ..I.
20:50:51.605315 IP (tos 0x0, ttl 64, id 21533, offset 0, flags [DF], proto TCP (6), length 52)
    127.0.0.1.59220 > 127.0.0.1.11211: Flags [R.], cksum 0xfe28 (incorrect -> 0x5b1c), seq 110, ack 49, win 128, options [nop,nop,TS val 2579319249 ecr 2579319249], length 0
        0x0000:  4500 0034 541d 4000 4006 e8a4 7f00 0001  E..4T.@.@.......
        0x0010:  7f00 0001 e754 2bcb 397d acf3 7b06 e165  .....T+.9}..{..e
        0x0020:  8014 0080 fe28 0000 0101 080a 99bd 49d1  .....(........I.
        0x0030:  99bd 49d1                                ..I.
20:50:51.605317 IP (tos 0x0, ttl 64, id 61625, offset 0, flags [DF], proto TCP (6), length 76)
    127.0.0.1.11211 > 127.0.0.1.59220: Flags [P.], cksum 0xfe40 (incorrect -> 0xd9f4), seq 49:73, ack 110, win 128, options [nop,nop,TS val 2579319249 ecr 2579319249], length 24
        0x0000:  4500 004c f0b9 4000 4006 4bf0 7f00 0001  E..L..@.@.K.....
        0x0010:  7f00 0001 2bcb e754 7b06 e165 397d acf3  ....+..T{..e9}..
        0x0020:  8018 0080 fe40 0000 0101 080a 99bd 49d1  .....@........I.
        0x0030:  99bd 49d1 8107 0000 0000 0000 0000 0000  ..I.............
        0x0040:  0004 0000 0000 0000 0000 0000            ............
20:50:51.605328 IP (tos 0x0, ttl 64, id 0, offset 0, flags [DF], proto TCP (6), length 40)
    127.0.0.1.59220 > 127.0.0.1.11211: Flags [R], cksum 0xb84d (correct), seq 964537587, win 0, length 0
        0x0000:  4500 0028 0000 4000 4006 3cce 7f00 0001  E..(..@.@.<.....
        0x0010:  7f00 0001 e754 2bcb 397d acf3 0000 0000  .....T+.9}......
        0x0020:  5004 0000 b84d 0000                      P....M..

```

</details>

The most interesting part is this
```
20:50:41.564624 IP (tos 0x0, ttl 64, id 21527, offset 0, flags [DF], proto TCP (6), length 52)
    127.0.0.1.59220 > 127.0.0.1.11211: Flags [.], cksum 0xfe28 (incorrect -> 0xa9fb), seq 29, ack 25, win 128, options [nop,nop,TS val 2579309208 ecr 2579309208], length 0
        0x0000:  4500 0034 5417 4000 4006 e8aa 7f00 0001  E..4T.@.@.......
        0x0010:  7f00 0001 e754 2bcb 397d aca2 7b06 e14d  .....T+.9}..{..M
        0x0020:  8010 0080 fe28 0000 0101 080a 99bd 2298  .....(........".
        0x0030:  99bd 2298                                ..".
20:50:51.564855 IP (tos 0x0, ttl 64, id 21528, offset 0, flags [DF], proto TCP (6), length 84)
    127.0.0.1.59220 > 127.0.0.1.11211: Flags [P.], cksum 0xfe48 (incorrect -> 0x55e5), seq 29:61, ack 25, win 128, options [nop,nop,TS val 2579319208 ecr 2579309208], length 32
        0x0000:  4500 0054 5418 4000 4006 e889 7f00 0001  E..TT.@.@.......
        0x0010:  7f00 0001 e754 2bcb 397d aca2 7b06 e14d  .....T+.9}..{..M
        0x0020:  8018 0080 fe48 0000 0101 080a 99bd 49a8  .....H........I.
        0x0030:  99bd 2298 800d 0008 0000 0000 0000 0008  ..".............
        0x0040:  0002 0000 0000 0000 0000 0000 7465 7374  ............test
        0x0050:  5f6b 6579                                _key
20:50:51.605253 IP (tos 0x0, ttl 64, id 61622, offset 0, flags [DF], proto TCP (6), length 52)
    127.0.0.1.11211 > 127.0.0.1.59220: Flags [.], cksum 0xfe28 (incorrect -> 0x5b92), seq 25, ack 61, win 128, options [nop,nop,TS val 2579319249 ecr 2579319208], length 0
        0x0000:  4500 0034 f0b6 4000 4006 4c0b 7f00 0001  E..4..@.@.L.....
        0x0010:  7f00 0001 2bcb e754 7b06 e14d 397d acc2  ....+..T{..M9}..
        0x0020:  8010 0080 fe28 0000 0101 080a 99bd 49d1  .....(........I.
        0x0030:  99bd 49a8                                ..I.
```

1) the last "initialization" packet was sent on `20:50:41.564624`
2) I added `sleep 10s` to test to make sure memcached done all its internal work after initialization.
3) at `20:50:51.564855` mget request for `test_key` was sent
4) it was answered at `20:50:51.605253`. It took 40,398 ms for the server to answer it. 
5) without `memcached_flush` or with `BINARY_PROTOCOL=0` the answer timings are less than 1ms.

**Comment by dormando** [comment]
What's memcached_flush doing exactly? calling `flush_all`?

I have no idea what all this initialization gunk is. Do you have a C gist?

**Comment by dormando** [comment]
if you keep requesting misses (say 1s apart) post-initflush/etc, does is lag every time or just the first time?

**Comment by dormando** [comment]
Squinting at the 20:50:51.605253 response packet, I don't see an 0x81 (response magic byte). I have no idea what that packet even is. hmm..

**Comment by dormando** [comment]
I gotta finish some other work today but I don't think I even see a miss coming back. I see what looks like a NOOP response later and then a QUIT command/response, maybe.

**Comment by k0ka** [comment]
Here is my test for `libmemcached_awesome`:

```C++
#include "test/lib/common.hpp"
#include "test/lib/MemcachedCluster.hpp"

TEST_CASE("memcached_poll_timeout") {
  auto test = MemcachedCluster{Cluster{Server{MEMCACHED_BINARY, {"-p", "11211"}}, 1}};
  auto memc = &test.memc;

  REQUIRE_SUCCESS(memcached_behavior_set(memc, MEMCACHED_BEHAVIOR_NO_BLOCK, 1));
  REQUIRE_SUCCESS(memcached_behavior_set(memc, MEMCACHED_BEHAVIOR_TCP_NODELAY, 0));
  REQUIRE_SUCCESS(memcached_behavior_set(memc, MEMCACHED_BEHAVIOR_BINARY_PROTOCOL, 1));
  REQUIRE_SUCCESS(memcached_behavior_set(memc, MEMCACHED_BEHAVIOR_POLL_TIMEOUT, 1000));

  memcached_return_t rc;
  size_t len;

  REQUIRE_SUCCESS(memcached_flush(memc, 0));

  sleep(10);

  const char* key = "test_key";
  len = strlen(key);
  const char *keys[1] = {key};

  REQUIRE_SUCCESS(memcached_mget(memc, keys, &len, 1));

  auto numResults = 0;
  while (auto rv = memcached_fetch(memc, nullptr, nullptr, nullptr, nullptr, &rc)) {
    REQUIRE_SUCCESS(rc);
    free(rv);

    numResults++;
    REQUIRE(numResults == 1);
  }

  if (MEMCACHED_END != rc && MEMCACHED_NOTFOUND != rc) {
    INFO(rc);
    REQUIRE(false);
  }
}
```

> does is lag every time or just the first time?

It does lag every time.
Also, here is the [test run](https://github.com/awesomized/libmemcached/actions/runs/4301629917/jobs/7499097534) on `libmemcached` on several versions of the server:. The test is named `memcached_poll_timeout`. It was quite overcomplicated because I was trying to catch another bug. The thing is it was requesting 500*499/2 keys most of which were missing. It took about 1200 seconds to fetch them. 1200 / 250 / 499 = 10ms for each key. 

> What's memcached_flush doing exactly? calling flush_all?

That's from `libmemcached-awesome`:
```C++
static memcached_return_t memcached_flush_binary(Memcached *ptr, time_t expiration,
                                                 const bool reply) {
  protocol_binary_request_flush request = {};

  request.message.header.request.opcode = PROTOCOL_BINARY_CMD_FLUSH;
  request.message.header.request.extlen = 4;
  request.message.header.request.datatype = PROTOCOL_BINARY_RAW_BYTES;
  request.message.header.request.bodylen = htonl(request.message.header.request.extlen);
  request.message.body.expiration = htonl((uint32_t) expiration);

  memcached_return_t rc = MEMCACHED_SUCCESS;

  for (uint32_t x = 0; x < memcached_server_count(ptr); x++) {
    memcached_instance_st *instance = memcached_instance_fetch(ptr, x);
    initialize_binary_request(instance, request.message.header);

    if (reply) {
      request.message.header.request.opcode = PROTOCOL_BINARY_CMD_FLUSH;
    } else {
      request.message.header.request.opcode = PROTOCOL_BINARY_CMD_FLUSHQ;
    }

    libmemcached_io_vector_st vector[] = {{NULL, 0}, {request.bytes, sizeof(request.bytes)}};

    memcached_return_t rrc;
    if (memcached_failed(rrc = memcached_vdo(instance, vector, 2, true))) {
      if (instance->error_messages == NULL or instance->root->error_messages == NULL) {
        memcached_set_error(*instance, rrc, MEMCACHED_AT);
      }
      rc = MEMCACHED_SOME_ERRORS;
    }
  }

  for (uint32_t x = 0; x < memcached_server_count(ptr); x++) {
    memcached_instance_st *instance = memcached_instance_fetch(ptr, x);

    if (instance->response_count() > 0) {
      (void) memcached_response(instance, NULL, 0, NULL);
    }
  }

  return rc;
}
```

**Comment by k0ka** [comment]
Uhm, I found a very weird part of it: 
setting `MEMCACHED_BEHAVIOR_TCP_NODELAY` to `1` in the test removes this lag. I saw it in other issues too:
https://github.com/php-memcached-dev/php-memcached/issues/24
https://github.com/symfony/symfony/pull/28249

But this settings must only affect the client side. Why server changes its behavior?..

**Comment by dormando** [comment]
Thanks for the snippits. I'm not sure when I'll get a chance to dig further... but in that tcpdump I'm pretty sure I don't see any miss packets. 10ms or 40ms aren't any sort of timeout being configured is there?

HMMMmmmmmmmmm wtf.

```
20:50:51.564855 IP (tos 0x0, ttl 64, id 21528, offset 0, flags [DF], proto TCP (6), length 84)
    127.0.0.1.59220 > 127.0.0.1.11211: Flags [P.], cksum 0xfe48 (incorrect -> 0x55e5), seq 29:61, ack 25, win 128, options [nop,nop,TS val 2579319208 ecr 2579309208], length 32
        0x0000:  4500 0054 5418 4000 4006 e889 7f00 0001  E..TT.@.@.......
        0x0010:  7f00 0001 e754 2bcb 397d aca2 7b06 e14d  .....T+.9}..{..M
        0x0020:  8018 0080 fe48 0000 0101 080a 99bd 49a8  .....H........I.
        0x0030:  99bd 2298 800d 0008 0000 0000 0000 0008  ..".............
        0x0040:  0002 0000 0000 0000 0000 0000 7465 7374  ............test
        0x0050:  5f6b 6579                                _key
```

I think that command is an 0x80 (magic byte) then 0x0d, which is GETKQ... which is the quiet version of the "get with key", which won't emit a response packet on a miss. If you send GETKQ's you're supposed to send a NOOP packet capped directly on top of it, and when you get the NOOP response you know you have all of your get responses.

So it sounds like the library is doing something broken with its mget interface? I'm guessing this only happens with mget?

**Comment by dormando** [comment]
I guess one more thing to throw out there; is this happening if you mget with a single key in the list? Does it happen if you mget with N keys?

Another technique for capping would be to send the "final" get request without GETKQ (ie GETK, or 0x0c), and once you receive that particular response back you're done. So it's possible it's expecting to do more work and when it doesn't it just drops it on the floor.

**Comment by k0ka** [comment]
I guess it's time to invite @m6w6 

The idea is that all requests from php are converted to `libmemcached` mget. So even if you ask for one key it will be converted to mget. It looks like `libmemcached` does it too - just for unification.

Asking for more than one key in php is quite rare action.

**Comment by dormando** [comment]
Yeah; sorry I don't have time to tear up the library. From your tcpdumps the actual commands start around 0x0034, so the packet that comes back from memcached after 40ms is not anything to do with the memcached protocol, it's likely nagle or tcp keepalive related. (sorry, don't have the energy to interpret the packet headers right now).

**Comment by dormando** [comment]
Sorry, distracted and spamming; iirc there is a NOOP packet toward the end there. it's most likely that libmemcached is jamming before sending the noop packet, which the server immediately responds to.

**Comment by k0ka** [comment]
Uhm, I ran it without `memcached_flush`. And here is that snippet:

```
22:27:30.613869 IP (tos 0x0, ttl 64, id 59322, offset 0, flags [DF], proto TCP (6), length 84)
    127.0.0.1.33596 > 127.0.0.1.11211: Flags [P.], cksum 0xfe48 (incorrect -> 0xb9b0), seq 1:33, ack 1, win 128, options [nop,nop,TS val 2585118257 ecr 2585118257], length 32
        0x0000:  4500 0054 e7ba 4000 4006 54e7 7f00 0001  E..T..@.@.T.....
        0x0010:  7f00 0001 833c 2bcb aece 43c9 7cb0 b2a6  .....<+...C.|...
        0x0020:  8018 0080 fe48 0000 0101 080a 9a15 c631  .....H.........1
        0x0030:  9a15 c631 800d 0008 0000 0000 0000 0008  ...1............
        0x0040:  0001 0000 0000 0000 0000 0000 7465 7374  ............test
        0x0050:  5f6b 6579                                _key
22:27:30.613871 IP (tos 0x0, ttl 64, id 15739, offset 0, flags [DF], proto TCP (6), length 52)
    127.0.0.1.11211 > 127.0.0.1.33596: Flags [.], cksum 0xfe28 (incorrect -> 0xe695), seq 1, ack 33, win 128, options [nop,nop,TS val 2585118257 ecr 2585118257], length 0
        0x0000:  4500 0034 3d7b 4000 4006 ff46 7f00 0001  E..4={@.@..F....
        0x0010:  7f00 0001 2bcb 833c 7cb0 b2a6 aece 43e9  ....+..<|.....C.
        0x0020:  8010 0080 fe28 0000 0101 080a 9a15 c631  .....(.........1
        0x0030:  9a15 c631  
```

It asks for the same 0x80 0x0d. And receives answer in 0.02ms

**Comment by dormando** [comment]
That second packet is _not_ the memcached protocol. that's just a packet. That's not a miss or an answer or anything at all

**Comment by dormando** [comment]
(also given your note about nodelay fixing it, this is probably just nagle's algorithm waiting for more data before it dequeues; the fact that flush makes it work or not work has more to do with the boundary of how much data is sitting in the write queue than anything to do with the protocol. the binary protocol should probably always have nodelay on)

**Comment by k0ka** [comment]
Yep, it looks like it's `libmemcache` problem.

**Comment by m6w6** [comment]
40ms seems to be the the TCP ACK delay on Linux. 

A bit of research led to
1. https://news.ycombinator.com/item?id=10608356
1. https://web.archive.org/web/20160304010518/http://neophob.com/2013/09/rpc-calls-and-mysterious-40ms-delay/
1. https://stackoverflow.com/a/2253620

Probably, because libmemcached does -- _of course_ -- its own writev implementation...

**Comment by dormando** [comment]
The delay/ack stuff is inconsequential. The flow here in the test is:
- initializer does a bunch of queries
- sends a FLUSHQ (quiet flush, for some reason)
- which sends a small packet but doesn't get a response from mc
- nagle kicks in, starts waiting for full packets to send
- the test starts and sends some getkq (quiet) + noop, all fitting under one packet
- nagle elects to wait for more data or an ack
- linux sends its delayed ack (40ms), nagle unjams and sends the rest of the requests
- mc response to the noop

So in general libmemcached needs to do one of two things:
- If in binprot and it wants to randomly send things it doesn't need a response to, use TCP_NODELAY always
- only ever send quiet requests when it makes sense; ie get requests or sets with a noop cap so that a response actually comes back.

**Comment by k0ka** [comment]
the issue was fixed long time ago
https://github.com/php-memcached-dev/php-memcached/issues/531
