### ISSUE TITLE
Memcached 1.5.5 is broken on alpine linux

### ISSUE THREAD

**Issue by stefan-improbable** [memcached/memcached#347]
How to reproduce:
```
$ docker run --net=host -it alpine:edge /bin/sh
/ # apk update
/ # apk add memcached
/ # memcached -V
memcached 1.5.5
/ # memcached -u root -l 127.0.0.1
```
When you run `printf "set mykey 0 60 4\r\ndata\r\n" | nc 127.0.0.1 11211` from inside or outside docker, it does not get any response from memcached. Note that `alpine:3.6` with memcached `1.4.36` works fine.

**Comment by dormando** [comment]
Any idea if any of the 1.5.x series works with alpine? Thought I fixed something with it recently.

Does anything happen on the server? Is it crashing, etc? Does "stats\r\n" work? Not too much to go on here :)

I need to get a buildbot for this, since this could be the second time I've broken it.

Thanks for the report!

**Comment by stefan-improbable** [comment]
@dormando `alpine:edge` with `memcache 1.5.5` and `alpine:3.7` with `memcache 1.5.3` don't work. I tried:
```
$ docker run --cap-add SYS_PTRACE --net=host -it alpine:3.7 /bin/sh
/ # apk update
/ # apk add memcached strace
/ # memcached -V
memcached 1.5.3
/ # strace -f memcached -u root -l 127.0.0.1
```
and `echo -e "stats\r\n" | nc localhost 11211`. Strace doesn't output anything, just some `nanosleep` calls. I tried running tcpdump and can see syn to memcached and ack back from memcached:

```
# Request sent
15:40:34.254821 IP ip6-localhost.39234 > ip6-localhost.11211: Flags [S], seq 3714839703, win 43690, options [mss 65495,sackOK,TS val 238807332 ecr 0,nop,wscale 7], length 0
15:40:34.254833 IP ip6-localhost.11211 > ip6-localhost.39234: Flags [S.], seq 2732777464, ack 3714839704, win 43690, options [mss 65495,sackOK,TS val 238807332 ecr 238807332,nop,wscale 7], length 0
15:40:34.254841 IP ip6-localhost.39234 > ip6-localhost.11211: Flags [.], ack 1, win 342, options [nop,nop,TS val 238807332 ecr 238807332], length 0
15:40:34.254866 IP ip6-localhost.39234 > ip6-localhost.11211: Flags [P.], seq 1:9, ack 1, win 342, options [nop,nop,TS val 238807332 ecr 238807332], length 8
15:40:34.294054 IP ip6-localhost.11211 > ip6-localhost.39234: Flags [.], ack 10, win 342, options [nop,nop,TS val 238807342 ecr 238807332], length 0

# Memcached in docker terminated
15:51:06.472931 IP ip6-localhost.11211 > ip6-localhost.39232: Flags [R.], seq 1, ack 10, win 342, options [nop,nop,TS val 238965386 ecr 238806284], length 0
15:51:06.472961 IP ip6-localhost.11211 > ip6-localhost.39234: Flags [R.], seq 1, ack 10, win 342, options [nop,nop,TS val 238965386 ecr 238807332], length 0
```

**Comment by dormando** [comment]
is it possible to get a `thread apply all bt` backtrace of the daemon via gdb?

**Comment by stefan-improbable** [comment]
Sure, but it doesn't seem to give me very valuable information:
```
(gdb) thread apply all bt

Thread 6 (LWP 186):
#0  0x00007f22db193f3a in __clone () from /lib/ld-musl-x86_64.so.1
#1  0x00007f22db191663 in ?? () from /lib/ld-musl-x86_64.so.1
#2  0x00007f22db28eb28 in ?? ()
#3  0x0000000000000000 in ?? ()

Thread 5 (LWP 185):
#0  0x00007f22db19163f in ?? () from /lib/ld-musl-x86_64.so.1
#1  0x00000000000000bf in ?? ()
#2  0x00005649cfdcff64 in ?? ()
#3  0xffffffff80000010 in ?? ()
#4  0x00007f22db190c86 in __timedwait_cp () from /lib/ld-musl-x86_64.so.1
#5  0x0000000000000000 in ?? ()

Thread 4 (LWP 183):
#0  0x00007f22db193f3a in __clone () from /lib/ld-musl-x86_64.so.1
#1  0x00007f22db191663 in ?? () from /lib/ld-musl-x86_64.so.1
#2  0x00007f22db2d3b28 in ?? ()
#3  0x0000000000000000 in ?? ()

Thread 3 (LWP 184):
#0  0x00007f22db193f3a in __clone () from /lib/ld-musl-x86_64.so.1
#1  0x00007f22db191663 in ?? () from /lib/ld-musl-x86_64.so.1
#2  0x00007f22db2bcb28 in ?? ()
#3  0x0000000000000000 in ?? ()

Thread 2 (LWP 178):
#0  0x00007f22db193f3a in __clone () from /lib/ld-musl-x86_64.so.1
#1  0x00007f22db191663 in ?? () from /lib/ld-musl-x86_64.so.1
#2  0x00007f22db3c7b28 in ?? ()
#3  0x0000000000000000 in ?? ()

Thread 1 (LWP 177):
#0  0x00007f22db193f3a in __clone () from /lib/ld-musl-x86_64.so.1
#1  0x00007f22db191663 in ?? () from /lib/ld-musl-x86_64.so.1
#2  0x00007f22db3cbbd0 in ?? () from /lib/ld-musl-x86_64.so.1
#3  0x0000000000000000 in ?? ()
```
I'm also attaching links to the binary and coredump:
- https://drive.google.com/file/d/1ekL0L9O-n1XZUtzPY7K3yx6t_2tpwKxj/view?usp=sharing 
- https://drive.google.com/file/d/1f13Noh3HvNQKNEUwci1xs4UseUxtWlwm/view?usp=sharing

**Comment by dormando** [comment]
hmm... can't really tell :/ might have to go run this thing myself somehow. I build locally against musl and the tests pass, so it must be something else.

just installed docker and tried it out... it's not even getting far enough to listen. it's like libevent is completely broken. there're no accept calls (or syscalls at all). backtrace shows nothing running epoll... the timer is working (that's the one second sleep) which does use libevent.

I'm fairly confused.

**Comment by dormando** [comment]
Background threads seem to actually start and work, I see the pipes being created, and listen calls/etc... but then nothing actually reaches the daemon from the network. I think the seccomp stuff might be installed.

Do you know how to rebuild memcached for alpine's docker setup? maybe remove the --enable-seccomp option if it's in there.

**Comment by stefan-improbable** [comment]
I tried rebuilding it without `--enable-seccomp` and it works. The list of commands for completeness
```
docker run --cap-add SYS_PTRACE --net=host -it alpine:3.7 /bin/sh
apk update
apk add alpine-sdk shadow
git clone --depth=1 git://git.alpinelinux.org/aports
cd aports/main/memcached/
abuild-keygen -a -i
addgroup root abuild
newgrp abuild
abuild -F -R fetch
abuild -F -R unpack
abuild -F -R deps
abuild -F -R build
./src/memcached-1.5.5/memcached -u root -l 127.0.0.1
```
The last command doesn't work but when you edit `APKBUILD` and remove `--enable-seccomp`, it works again.

**Comment by dormando** [comment]
Great, ok... Any chance you could file a bug with the alpine folks and tell them to remove the seccomp?

@viraptor I thought this wasn't supposed to silently fail :( did I break it already?

**Comment by viraptor** [comment]
Thanks for pinging me. If it's alpine, the issue is likely with the musl not doing the same syscalls glibc does. I'll have a look at this tonight.

The current behaviour is to return EACCESS when something's breaking the policy, so if the error is handled, it should be reported... (https://github.com/memcached/memcached/blob/master/linux_priv.c#L9)

**Comment by dormando** [comment]
I don't think I saw any EACCESS..

just tried building against my local musl compile with --enable-seccomp and it failed to link:
```
/usr/lib/gcc/x86_64-linux-gnu/5/./libgcov.a(_gcov.o): In function `gcov_error':
(.text+0x1ca): undefined reference to `__vfprintf_chk'
/usr/lib/gcc/x86_64-linux-gnu/5/./libgcov.a(_gcov.o): In function `gcov_do_dump':
(.text+0x1782): undefined reference to `__fprintf_chk'
collect2: error: ld returned 1 exit status
```

musl library's a bit old now.

**Comment by stefan-improbable** [comment]
@dormando I've opened a PR with them: https://github.com/alpinelinux/aports/pull/3439/files

**Comment by viraptor** [comment]
```
epoll_pwait(3, 0x7f42f29bab20, 32, 996, NULL, 8) = -1 EACCES (Permission denied)
writev(2, [{iov_base="[warn] epoll_wait: Permission de"..., iov_len=37}, {iov_base=NULL, iov_len=0}], 2) = -1 EACCES (Permission denied)
```
So yes - both the syscall is blocked and the error is printed using writev from musl, so we couldn't see it.

**Comment by viraptor** [comment]
There were a few calls missing and unfortunately they broke printing out the error message as well.

While fixing, I noticed that debug output (`-vv`) from worker threads didn't work on glibc as well - also fixed.

**Comment by dormando** [comment]
@stefan-improbable any chance you could try his branch? would save me some time :)

**Comment by viraptor** [comment]
@dormando I just noticed that Travis supports docker builds. What do you think about testing against debian:latest and alpine:latest with seccomp enabled automatically? (I'm not sure there any distribution with ulibc, but maybe worth checking) Happy to write all the configs if you're interested.

**Comment by dormando** [comment]
@viraptor I have a buildbot network (http://build.memcached.org:8010) made up of on-demand DO snapshots... because travis doesn't have all the platforms I need.

I'm not too familiar with docker; if you give me some hints or an example script (and hopefully 512mb of RAM is okay) I can get that hooked into the buildbots. I want to invest some time today to upgrade the software (they did a slave -> worker transition and broke some things) since that's preventing freebsd from joining the network. So any hints with docker would be welcome :)

**Comment by dormando** [comment]
I think also doing some specifically against musl but outside of containers might be good too, I've been doing local builds. And I need to add builder variations for extstore + seccomp + etc :|

**Comment by viraptor** [comment]
Proof-of-concept style docker definitions added in https://github.com/memcached/memcached/pull/351

**Comment by stefan-improbable** [comment]
@dormando I've tried https://github.com/memcached/memcached/pull/349 on alpine and it fixes my issue.

**Comment by dormando** [comment]
@stefan-improbable thanks! I'll be doing another bug squash this week, likely.

**Comment by dormando** [comment]
released in 1.5.7
